title,authors,isbn13
Doctor Who Short Trips: Repercussions,Gary Russell/Peter Anghelides/J. Shaun Lyon/Jon de Burgh Miller/Eddie Robson/Todd Green/Andy Russell/Andrew Collins/Kathryn Sullivan/Iain McLaughlin/Mark Michalowski/Joseph Lidster/Trevor Baxendale/Colin Brake/Claire Bartlett/Sarah Groenewegen/Trey Korte/Andy Frankham-Allen,9781844350483
Gerontius,James Hamilton-Paterson,9781862074934
Hellstrom's Hive,Frank Herbert,9780553144383
The Dark City (Eliot Ness  #1),Max Allan Collins,9780727862426
Bullet Proof (Eliot Ness  #3),Max Allan Collins,9780727862983
The Penguin Companion to European Literature,Anthony Thorlby,9780140510355
West To Eden,Gloria Goldreich,9780380706013
The Various,Steve Augarde,9780440420293
Truman Capote: In Which Various Friends  Enemies  Acquaintances  and Detractors Recall His Turbulent Career,George Plimpton,9780385491730
The Burnt Orange Heresy,Charles Willeford,9780786706686
Ewan McGregor: From Junkie to Jedi,Brian J. Robb,9780859652766
Shadow Twin,Gardner Dozois/George R.R. Martin/Daniel Abraham,9781596060296
Der Prophet,Kahlil Gibran,9783530268034
Le prophète,Kahlil Gibran,9782844541840
The Complete Stories of Robert Louis Stevenson: Strange Case of Dr. Jekyll and Mr. Hyde and Nineteen Other Tales,Robert Louis Stevenson/Barry Menikoff,9780375761355
The Complete Short Stories Of Robert Louis Stevenson: With A Selection Of The Best Short Novels,Robert Louis Stevenson/Charles Neider,9780306808821
A Child's Garden of Verses,Robert Louis Stevenson/Tasha Tudor,9780689823824
Have Space Suit—Will Travel,Robert A. Heinlein,9781416505495
Practicalities,Marguerite Duras/Barbara Bray,9780802133113
Le ravissement de Lol V. Stein,Marguerite Duras,9782070368105
India Song,Marguerite Duras/Barbara Bray,9780802131355
Clown,Quentin Blake,9780805059335
The Spiral Stair (Arabel and Mortimer  #6),Joan Aiken/Quentin Blake,9781903015070
A Near Thing for Captain Najork (Captain Najork #2),Russell Hoban/Quentin Blake,9781567923230
Reptiles and Amphibians (Smithsonian Handbooks),Mark O'Shea/Tim Halliday/Jonathan Metcalf,9780789493934
The Camera (Ansel Adams Photography  #1),Ansel Adams/Robert Hardy Baker,9780821221846
The Negative (Ansel Adams Photography  #2),Ansel Adams/Robert Hardy Baker,9780821221860
The Print (Ansel Adams Photography  #3),Ansel Adams/Robert Hardy Baker,9780821221877
The Changing Status of the Artist,Emma Barker/Nick Webb/Kim W. Woods,9780300077421
Vicars of Christ: A History of the Popes,Charles A. Coulombe,9780806523705
The Big Bing: Black Holes of Time Management  Gaseous Executive Bodies  Exploding Careers  and Other Theories on the Origins of the Business Universe,Stanley Bing,9780060529574
What Would Machiavelli Do?: The Ends Justify the Meanness,Stanley Bing,9780066620107
William James: In the Maelstrom of American Modernism,Robert D. Richardson Jr.,9780618433254
Cliffs Notes on Wright's Black Boy,Carl Senna/CliffsNotes/Richard Wright,9780822002420
The Wit and Wisdom of Abraham Lincoln: A Book of Quotations,Abraham Lincoln/Bob Blaisdell,9780486440972
Speeches and Writings 1832–1858,Abraham Lincoln/Don E. Fehrenbacher,9780940450431
Selected Speeches and Writings,Abraham Lincoln/Gore Vidal,9780679737315
George Eliot: The Last Victorian,Kathryn  Hughes,9780815411215
The Mill on the Floss,George Eliot/A.S. Byatt,9780141439624
Scenes of Clerical Life,George Eliot/Thomas A. Noble,9780192837806
Terry Jones' Medieval Lives,Terry Jones/Alan Ereira,9780563522751
Terry Jones' Fairy Tales,Terry Jones/Michael Foreman,9780140322620
Some Ether,Nick Flynn,9781555973032
Tin House: Evil (Volume 8 no. 3),Chris Adrian/Nick Flynn/Francine Prose/Josip Novakovich/Moonshine,9780977698943
A Note Slipped Under the Door: Teaching from Poems We Love,Nick Flynn/Shirley McPhillips/Philippa Stratton,9781571103208
The Trouble with Testosterone and Other Essays on the Biology of the Human Predicament,Robert M. Sapolsky,9780684838915
Monkeyluv: And Other Essays on Our Lives as Animals,Robert M. Sapolsky,9780743260169
Literary Criticism  Vol. 1: Essays on Literature / American Writers / English Writers,Henry James/Leon Edel/Mark Wilson,9780940450226
Advanced Statistics Demystified,Larry J. Stephens,9780071432429
Lilly's Big Day,Kevin Henkes,9780060742362
Chester's Way,Kevin Henkes,9780688154721
Julius  the Baby of the World,Kevin Henkes,9780688143886
Forms of Talk,Erving Goffman,9780812211122
Interaction Ritual - Essays on Face-to-Face Behavior,Erving Goffman,9780394706313
Study Bible: NIV,Anonymous,9780310929550
My Lord Eternity (Immortal Rogues  #2),Debbie Raleigh/Alexandra Ivy,9780821775509
Aesop's Fables,Aesop/Ann McGovern,9780590438808
Once A Wolf: How Wildlife Biologists Fought to Bring Back the Gray Wolf,Stephen R. Swinburne/Jim Brandenburg,9780618111206
Conversations with Don DeLillo,Don DeLillo/Thomas DePietro,9781578067046
Inventing America: Jefferson's Declaration of Independence,Garry Wills,9780618257768
Venice: Lion City: The Religion of Empire,Garry Wills,9780671047641
Four Weddings and a Funeral,Richard Curtis,9780312143404
Halloween,Richard Curtis,9780553262964
Janet  My Mother and Me: A Memoir of Growing Up with Janet Flanner and Natalia Danesi Murray,William Murray,9780684809663
Catch That Pass!,Matt Christopher,9780316139243
Divide and Conquer (Tom Clancy's Op-Center  #7),Jeff Rovin/Tom Clancy/Steve Pieczenik,9780425174807
Death Match (Tom Clancy's Net Force Explorers  #18),Diane Duane/Tom Clancy/Steve Pieczenik,9780425184486
Line of Control (Tom Clancy's Op-Center  #8),Jeff Rovin/Tom Clancy/Steve Pieczenik,9780425180051
Sea of Fire (Tom Clancy's Op-Center  #10),Jeff Rovin/Tom Clancy/Steve Pieczenik,9780425190913
One is the Loneliest Number (Tom Clancy's Net Force Explorers  #3),Diane Duane/Tom Clancy/Steve Pieczenik,9780425164174
Aliens: Nightmare Asylum,Steve Perry,9780553561586
The Omega Cage (Matador  #4),Steve Perry/Michael Reaves,9780441623822
The 97th Step (Matador  #5),Steve Perry,9780441581054
A Friar's Bloodfeud (Knights Templar  #20),Michael Jecks,9780755323005
Death Ship of Dartmouth (Knights Templar  #21),Michael Jecks,9780755323012
The John Deere Two-Cylinder Tractor Encyclopedia: The Complete Model-by-Model History,Don Macmillan/Wayne G. Broehl Jr.,9780760329634
Phantoms,Rosalind M. Greenberg,9780886773489
Fantasy Gone Wrong,Martin H. Greenberg/Brittiany A. Koren/Brian Stableford/Mickey Zucker Reichert/Fiona Patton/Jim C. Hines/Esther M. Friesner/Donald J. Bingle/Alan Dean Foster/Devon Monk/Phaedra M. Weldon/Christina F. York/Jana Paniccia/Josepha Sherman/Susan Sizemore/Michael Jasper/Janny Wurts/Lisanne Norman,9780756403805
The Ghosts in Baker Street: New Tales of Sherlock Holmes,Martin H. Greenberg/Daniel Stashower,9780786714001
Christmas Bestiary,Martin H. Greenberg/Jack Nimersheim/Jane Yolen/Jack C. Haldeman II/Harry Turtledove/Laura Resnick/Mike Resnick/Karen Haber/Jane Lindskold/Lawrence Schimel/Barry N. Malzberg/Tanya Huff/Michelle Sagara West/Mark Aronson/Stefan R. Dziemianowicz/Jennifer Roberson/Kristine Kathryn Rusch/Elizabeth Ann Scarborough/Barbara Delaplace/Barb Jernigan/Blake Cahoon,9780886775285
Black Cats and Broken Mirrors,John Helfers/Esther M. Friesner/Nina Kiriki Hoffman/Bruce Holland Rogers/Peter Crowther/R. Davis/Charles de Lint/Elizabeth Ann Scarborough/Michelle Sagara West/Nancy Springer/Dean Wesley Smith/Kristine Kathryn Rusch/Josepha Sherman/Jane Lindskold/Genevieve Gorman/Kristin Schwengel/Jean-François Podevin/Zane Stillings/Carol Rondou,9780886777883
Time Twisters,Jean Rabe/Martin H. Greenberg/Stephen Leigh/Gene DeWeese/Joe Masdon/Donald J. Bingle/Skip Williams/Penny Williams/Pierce Askegren/Nancy Virginia Varian/Wes Nicholson/John Helfers/Chris Pierson/Harry Turtledove/Kevin J. Anderson/Robert E. Vardeman/Jackie Cassada/James M. Ward/Jon L. Breen/Linda P. Baker,9780756404055
The Western Canon: The Books and School of the Ages,Harold Bloom,9781573225144
Shakespeare: The Invention of the Human,Harold Bloom,9781573227513
The American Religion,Harold Bloom,9780978721008
American Caesar: Douglas MacArthur 1880-1964,William Manchester,9780316544986
Winchester Shotguns,Dennis Adler/R.L. Wilson,9780785821083
Colossians and Philemon: A Critical and Exegetical Commentary (International Critical Commentary),R. McL. Wilson,9780567044716
Maurice Sendak's Seven Little Monsters: What Time is It? - Book #4,Arthur Yorinks/Raymond Jafelice,9780786817788
Meditations for Manifesting: Morning and Evening Meditations to Literally Create Your Heart's Desire,Wayne W. Dyer,9781561703159
There's a Spiritual Solution to Every Problem,Wayne W. Dyer,9780060192303
Michael Smith Elements of Style,Michael S.  Smith/Diane Dorrans Saeks,9780847827626
Spares,Michael Marshall Smith,9780006512677
One of Us,Michael Marshall Smith,9780553580693
The Secret City (Pyrates  #1),Chris Archer,9780439368513
The Theory and Practice of Group Psychotherapy,Irvin D. Yalom/Molyn Leszcz,9780465092840
When Nietzsche Wept,Irvin D. Yalom,9780060748128
Existential Psychotherapy,Irvin D. Yalom,9780465021475
Crown of Stars (Crown of Stars  #7),Kate Elliott,9780756404062
Crown Duel (Crown & Court #1-2),Sherwood Smith,9780142301517
A Rose for the Crown,Anne Easter Smith,9780743276870
The Bloody Crown of Conan (Conan the Cimmerian  #2),Robert E. Howard/Gary Gianni/Patrice Louinet,9780345461520
Rough Crossings: Britain  the Slaves and the American Revolution,Simon Schama,9780060539160
Landscape and Memory,Simon Schama,9780679735120
The Embarrassment of Riches: An Interpretation of Dutch Culture in the Golden Age,Simon Schama,9780679781240
Citizens: A Chronicle of the French Revolution,Simon Schama,9780141017273
The Feelings Book: The Care & Keeping of Your Emotions,Lynda Madison/Bonnie Timmons/Norm Bendell,9781584855286
A Smart Girl's Guide to Money: How to Make It  Save It  And Spend It,Nancy Holyoke/Ali Douglass,9781593691035
What Would You Do? (American Girl Library),Patti Kelley Criswell/Norm Bendell,9781584858744
The Halloween Activity Book: Creepy  Crawly  Hairy  Scary Things to Do,Mymi Doinet/Benjamin Chaud,9780811832793
The Capricorn Stone,Madeleine Brent,9780449201497
Golden Urchin,Madeleine Brent,9780449213896
The Ethics of Ambiguity,Simone de Beauvoir/Bernard Frechtman,9780806501604
She Came to Stay,Simone de Beauvoir,9780006540809
The Coming of Age,Simone de Beauvoir/Patrick O'Brian,9780393314434
A Transatlantic Love Affair: Letters to Nelson Algren,Simone de Beauvoir/Nelson Algren/Sylvie Le Bon de Beauvoir/Vanessa Kling/Ellen Gordon Reeves,9781565845602
La force de l'âge,Simone de Beauvoir,9782070377824
What Life Was Like When Rome Ruled the World: The Roman Empire  100 BC - AD 200 (What Life Was Like),Time-Life Books,9780783554525
Sudden Fiction International: 60 Short-Short Stories,Robert Shapard/James Thomas,9780393306132
Sudden Fiction: American Short-Short Stories,Robert Shapard/James Thomas,9780879052652
Sarah Bernhardt,Elizabeth Silverthorne/Betty McCollum,9780791074589
The Art of Controversy (The Essays of Arthur Schopenhauer),Thomas Bailey Saunders,9781419161308
The Wisdom of Life,Arthur Schopenhauer/Thomas Bailey Saunders,9780486435503
For All Time (Time Travelers  #4),Caroline B. Cooney,9780440229315
Wanted!,Caroline B. Cooney,9780590988490
The Time Travelers: Volume One,Caroline B. Cooney,9780553494808
Every Night Italian: Every Night Italian,Giuliano Hazan/Marcella Hazan/Dana Gallagher,9780684800288
More Classic Italian Cooking,Marcella Hazan,9780345314031
Practice Makes Perfect: Italian Verb Tenses,Paola Nanni-Tate,9780071451383
Effigies (Faye Longchamp  #3),Mary Anna Evans,9781590583425
The Cambridge Companion to Schopenhauer,Christopher Janaway,9780521629249
Stormie: A Story of Forgiveness and Healing,Stormie Omartian,9781565078321
The Orion Mystery: Unlocking the Secrets of the Pyramids,Robert Bauval/Adrian Geoffrey Gilbert,9780517884546
Orion (Orion  #1),Ben Bova,9780812532470
Lake Orion (Images of America: Michigan),James E. Ingram/Lori Grove,9780738539560
Rick Steves' Europe Through the Back Door,Rick Steves,9781566918084
A Dangerous Man (Hank Thompson  #3),Charlie Huston,9780345481337
Already Dead (Joe Pitt  #1),Charlie Huston,9780345478245
Caught Stealing (Hank Thompson  #1),Charlie Huston,9780345464781
Ultimate Annuals  Volume 2,Charlie Huston/Mike Carey/Brian Michael Bendis/Robert Kirkman/Mike Deodato/Ryan Sook/Stuart Immonen/Frazier Irving,9780785123712
Dead I Well May Be (Dead Trilogy #1),Adrian McKinty,9780743470568
The Dead Yard (Michael Forsythe #2),Adrian McKinty,9780743499484
The Lighthouse Land (Lighthouse Trilogy #1),Adrian McKinty,9780810954809
Spider Mountain (Cam Richter  #2),P.T. Deutermann,9780312333799
The Edge of Honor,P.T. Deutermann,9780312953966
The Firefly,P.T. Deutermann,9780312994815
Diary of a Spider,Doreen Cronin/Harry Bliss,9780060001537
The Snow Spider (Snow Spider Trilogy  #1),Jenny Nimmo,9780439896757
Ultimate Spider-Man  Volume 16: Deadpool,Brian Michael Bendis/Mark Bagley,9780785119272
Ultimate Spider-Man  Volume 7,Brian Michael Bendis/Mark Bagley,9780785121480
Fables: 1001 Nights of Snowfall,Bill Willingham/Esao Andrews/John Bolton/Mark Buckingham/James Jean/Derek Kirk Kim/Tara  McPherson/Jill Thompson/Mark Wheatley/Michael Wm. Kaluta/Charles Vess/Brian Bolland,9781401203672
Cold Fire / Hideaway / The Key to Midnight,Dean Koontz/Leigh Nichols,9780399146268
Fables  Vol. 8: Wolves,Bill Willingham/Mark Buckingham/Steve Leialoha/Shawn McManus/Andrew Pepoy,9781401210014
Fables  Vol. 4: March of the Wooden Soldiers,Bill Willingham/Mark Buckingham/Craig Hamilton/Steve Leialoha/P. Craig Russell,9781401202224
Fables  Vol. 1: Legends in Exile,Bill Willingham/Terry Moore/Mike Allred/Lan Medina/Mark Buckingham/Matthew Sturges/Steve Leialoha/Craig Hamilton/Russ Braun/James Jean/Tony Akins/Eric Shanower/Shawn McManus/Jae Lee/Chrissie Zullo/David Petersen,9781563899423
Fables  Vol. 7: Arabian Nights (and Days),Bill Willingham/Mark Buckingham/Steve Leialoha/Jim Fern/Jimmy Palmiotti/Andrew Pepoy,9781401210007
Fables  Vol. 6: Homelands,Bill Willingham/David Hahn/Mark Buckingham/Lan Medina/Steve Leialoha,9781401205003
Fables  Vol. 3: Storybook Love,Bill Willingham/Bryan Talbot/Lan Medina/Mark Buckingham/Linda Medley/Steve Leialoha/James Jean,9781401202569
Fables  Vol. 5: The Mean Seasons,Bill Willingham/Mark Buckingham/Steve Leialoha/Tony Akins/Jimmy Palmiotti,9781401204860
The Choice: A Fable of Free Trade and Protectionism,Russell Roberts/Russ Roberts,9780131433540
Brewer's Dictionary of Phrase and Fable,John Ayto,9780061121203
Jack of Fables  Vol. 1: The (Nearly) Great Escape,Bill Willingham/Matthew Sturges/Tony Akins/Andrew Pepoy,9781401212223
Math Fables,Greg Tang/Heather Cahoon,9780439454001
The Five Dysfunctions of a Team: A Leadership Fable,Patrick Lencioni,9780787960759
Icebound,David Axton/Dean Koontz/Paul Michael,9780739341414
Odd Thomas (Odd Thomas #1),Dean Koontz/David Baker,9780739301760
Seize the Night (Moonlight Bay  #2),Dean Koontz/Keith Szarabajka,9780553479010
From the Corner of His Eye,Dean Koontz/Stephen Lang,9780553502695
The Good Guy,Dean Koontz/Richard Ferrrone,9780739332931
3rd Degree,James Patterson/Andrew Gross/Carolyn McCormick,9781586215989
2nd Chance (Women's Murder Club #2),James Patterson/Melissa Leo/Jeremy Piven/Andrew Gross,9781594831164
The Big Bad Wolf,James Patterson/Peter J. Fernandez/Denis O'Hare,9781586215804
Pop Goes the Weasel,James Patterson/Roger Rees/Keith David,9781594836114
The Winds of War (The Henry Family  #1),Herman Wouk,9780316952668
Hollywood Station (Hollywood Station  #1),Joseph Wambaugh,9780316066143
The Choirboys,Joseph Wambaugh,9780752851310
Fire Lover: A True Story,Joseph Wambaugh,9780060095277
Floaters,Joseph Wambaugh,9780553575958
The New Centurions,Joseph Wambaugh,9780440164173
The Black Marble,Joseph Wambaugh,9780440613961
The Secrets of Harry Bright,Joseph Wambaugh,9780722189146
Lines and Shadows,Joseph Wambaugh,9780553763256
Hollywood Tough (Shane Scully  #3),Stephen J. Cannell/Paul Michael/Michael Prichard,9781559278225
Cold Hit (Shane Scully #5),Stephen J. Cannell/Scott Brick,9781593977733
Trunk Music (Harry Bosch  #5; Harry Bosch Universe  #6),Michael Connelly/Dick Hill,9781423323389
Angels Flight (Harry Bosch  #6),Michael Connelly/Dick Hill,9781597376853
The Black Echo (Harry Bosch  #1; Harry Bosch Universe  #1),Michael Connelly/Dick Hill,9781423323259
The Closers (Harry Bosch  #11; Harry Bosch Universe  #14),Michael Connelly/Len Cariou,9781594830204
Echo Park (Harry Bosch  #12; Harry Bosch Universe  #16),Michael Connelly/Len Cariou,9781594835896
The Poet (Jack McEvoy  #1; Harry Bosch Universe  #5),Michael Connelly/Buck Schirner,9781423323235
The Concrete Blonde (Harry Bosch  #3),Michael Connelly/Dick Hill,9781596009202
The Best American Mystery Stories 2003,Michael Connelly/Otto Penzler,9780618390724
Hundred-Dollar Baby (Spenser  #34),Robert B. Parker/Joe Mantegna,9780739318652
The Spenser Collection: Volume I (Spenser  #27-28),Robert B. Parker/Joe Mantegna,9780739340196
School Days (Spenser  #33),Robert B. Parker/Joe Mantegna,9780739318614
Potshot (Spenser  #28),Robert B. Parker/Joe Mantegna,9780553702460
Chance (Spenser  #23),Robert B. Parker/Burt Reynolds,9780787107123
The Accidental Time Machine,Joe Haldeman,9780441014996
A Separate War and Other Stories,Joe Haldeman/Connie Willis,9780441014071
The Forever War (The Forever War  #1),Joe Haldeman,9780060510862
Worlds Enough and Time (Worlds #3),Joe Haldeman,9780688090258
The Coming,Joe Haldeman,9780441008766
Forever Peace (The Forever War  #2),Joe Haldeman,9780441005666
Dealing in Futures,Joe Haldeman,9780451452580
Study War No More: A Selection of Alternatives,Joe Haldeman/William Nabors/Harry Harrison/Damon Knight/Harlan Ellison/Ben Bova/Poul Anderson/Isaac Asimov/Mack Reynolds/Alec Effinger,9780380405190
Not of Woman Born,Constance Ash/Nina Kiriki Hoffman/Patricia A. McKillip/Walter Jon Williams/Debra Doyle/James D. Macdonald/Kara Dalkey/Michael Armstrong/Richard Parks/Sage Walker/Susan Palwick/William F. Wu/Jack McDevitt/Janni Lee Simner/Robert Silverberg,9780451456816
Worlds Apart (Worlds 2),Joe Haldeman,9780380716821
Train_man  Volume 3 (Train_man),Hidenori Hara/Hitori Nakano,9781421508504
The Best American Mystery Stories 2004,Nelson DeMille/Otto Penzler,9780618497423
Mystic River,Dennis Lehane,9780060584757
Coronado: Stories,Dennis Lehane,9780061139673
Prayers for Rain (Kenzie & Gennaro  #5),Dennis Lehane,9780380730360
A Drink Before the War (Kenzie & Gennaro  #1),Dennis Lehane,9780156029025
Shutter Island,Dennis Lehane,9780380731862
The Best American Mystery Stories 2002,James Ellroy/Otto Penzler/John Biguenet/Michael Connelly/Thomas H. Cook/Sean Doolittle/Brendan DuBois/David Edgerley Gates/Joe Gores/James Grady/Clark Howard/Stuart M. Kaminsky/Joe R. Lansdale/Michael Malone/Annette Meyers/Joyce Carol Oates/Robert B. Parker/F.X. Toole/Daniel Waterman/Scott Wolven/Fred Melton,9780618258079
The Black Dahlia (L.A. Quartet  #1),James Ellroy,9780446698870
The Black Dahlia Files: The Mob  the Mogul  and the Murder That Transfixed Los Angeles,Donald H. Wolfe,9780060582500
Corroborating Evidence: The Black Dahlia Murder,William T. Rasmussen,9780865344921
Childhood Shadows: The Hidden Story of the Black Dahlia Murder,Mary  Pacios,9781585004843
Triptych (Will Trent  #1),Karin Slaughter,9780385339469
Blindsighted (Grant County  #1),Karin Slaughter,9780380820887
Kisscut (Grant County  #2),Karin Slaughter,9780060534042
Beyond Reach (Grant County  #6),Karin Slaughter,9780385339476
A Faint Cold Fear (Grant County  #3),Karin Slaughter,9780060534059
Faithless (Grant County  #5),Karin Slaughter,9780440242918
Like A Charm,Karin Slaughter/Peter Robinson/John Connolly/Denise Mina/Mark Billingham,9780060583316
Like a Charm,Karin Slaughter/Denise Mina/John Harvey/Kelley Armstrong/John Connolly/Emma Donoghue/Jane Haddam/Laura Lippman/Peter Robinson/Fidelis Morgan/Peter Moore Smith/Lynda La Plante/Jerrilyn Farmer/Lee Child/Mark Billingham,9780099462255
The Enemy (Jack Reacher  #8),Lee Child/Dick Hill,9781593553944
The Visitor (Jack Reacher  #4),Lee Child/Hayward Morse/Garrick Hagon,9781860428784
Tripwire (Jack Reacher  #3),Lee Child/Dick Hill,9781567408348
Killing Floor (Jack Reacher  #1),Lee Child/Dick Hill,9781593555580
Without Fail (Jack Reacher  #6),Lee Child/Dick Hill,9781590860625
One Shot (Jack Reacher  #9),Lee Child/Dick Hill,9781593555191
Bad Luck and Trouble (Jack Reacher  #11),Lee Child,9780739340677
Echo Burning (Jack Reacher  #5),Lee Child,9781423319528
Blood on the Moon: The Assassination of Abraham Lincoln,Edward Steers Jr.,9780813191515
The Blood of the Moon: Understanding the Historic Struggle Between Islam and Western Civilization,George Grant,9780785265436
Blood on the Moon (Lloyd Hopkins  #1),James Ellroy,9781400095285
Blood Moon Over Bengal,Morag McKendrick Pippin,9780843954524
Blood Moon Over Britain,Morag McKendrick Pippin,9780843955828
The Silent Gondoliers,William Goldman,9780345442635
Heat,William Goldman,9780446300001
Tinsel,William Goldman,9780440187356
The Princess Bride,William Goldman,9780345418265
Hype and Glory,William Goldman/P. Gethers,9780679734789
La princesa prometida,William Goldman,9788427030978
Boys and Girls Together,William Goldman,9780345439734
Wait Till Next Year: The Story of a Season When What Should've Happened Didn't  and What Could've Gone Wrong Did,William Goldman/Mike Lupica,9780553053197
The Princess Bride: S. Morgenstern's Classic Tale of True Love and High Adventure,William Goldman,9780151730858
Creepers,David Morrell,9781593153571
The Totem,David Morrell,9780446691901
The League of Night and Fog (Mortalis  #3),David Morrell,9780446691925
Scavenger (Frank Balenger  #2),David Morrell,9781593154417
The Fraternity of the Stone (Mortalis  #2),David Morrell,9780747238911
The Brotherhood of the Rose (Mortalis  #1),David Morrell,9780747238904
The Protector (Cavanaugh #1),David Morrell,9780446530682
Assumed Identity,David Morrell,9780446600705
Double Image,David Morrell,9782253172284
La Cinquième profession,David Morrell,9782253060703
The Last Kingdom (The Saxon Stories  #1),Bernard Cornwell/Jamie Glover,9780061126574
Time To Hunt (Bob Lee Swagger  #3),Stephen Hunter/Beau Bridges,9780553455809
Black Light (Bob Lee Swagger  #2),Stephen Hunter/Beau Bridges,9780553477481
The Day Before Midnight,Stephen Hunter/Philip Bosco,9780553452112
Hot Springs (Earl Swagger  #1),Stephen Hunter/Jay O. Sanders,9780743500265
Point Of Impact (Bob Lee Swagger  #1),Stephen Hunter/Beau Bridges,9780739344248
Dirty White Boys,Stephen Hunter/Will Patten,9781570421921
Bevor es Nacht wird. Ein Leben in Havanna,Reinaldo Arenas,9783423129862
The Book of the Dead  (Pendergast  #7; Diogenes  #3),Douglas Preston/Lincoln Child/Scott Brick,9781594832284
Relic (Pendergast #1),Douglas Preston/Lincoln Child,9781423330417
The Wheel of Darkness (Pendergast  #8),Douglas Preston/Lincoln Child,9781594839412
Tyrannosaur Canyon,Douglas Preston/Scott Sowers,9781593977795
Waterworks,E.L. Doctorow/Sam Waterston,9780679433729
The Devil in the White City: Murder  Magic  and Madness at the Fair That Changed America,Erik Larson/Tony Goldwyn,9780739303405
King Icahn,Mark      Stevens/Carol Bloom Stevens,9780525936138
The Sicilian,Mario Puzo,9780345441706
The Dark Arena,Mario Puzo,9780345441690
Omerta,Mario Puzo,9780345432407
Fools Die,Mario Puzo,9780451160195
The Godfather,Mario Puzo/Peter Bart/Robert Thompson,9780451217400
The Fortunate Pilgrim,Mario Puzo,9780345476722
On the Road to Perdition — Oasis  Sanctuary  and Detour — (Road to Perdition  #2),Max Allan Collins/José Luis García-López/Steve Lieber/Josef Rubinstein/Rob Leigh/Bob Lappan,9781401203573
Oasis (On the Road to Perdition  #1),Max Allan Collins/Steve Lieber/Josef Rubinstein/Rob Leigh/José Luis García-López/Bob Lappan,9781401200688
Double Dealer (CSI: Crime Scene Investigation  #1),Max Allan Collins/Mike Flaherty,9780743444040
The London Blitz Murders (Disaster Series  #5),Max Allan Collins,9780425198056
The Last Quarry (Quarry #7),Max Allan Collins,9780843955934
Snake Eyes (CSI: Crime Scene Investigation  #8),Max Allan Collins,9780743496650
A Killing in Comics (Jack & Maggie Starr  #1),Max Allan Collins/Terry Beatty,9780425213650
The War of the Worlds Murder (Disaster Series  #6),Max Allan Collins,9780425204016
From a Buick 8,Stephen King,9780743211376
The Michael Crichton Collection: Jurassic Park / The Lost World / The Andromeda Strain,Michael Crichton/Chris Noth/Anthony Heald,9780375415807
Jurassic Park,Michael Crichton,9780345418951
Binary,John Lange,9780394479873
Un train d'or pour la Crimée,Michael Crichton,9782266070072
The Voices of Morebath: Reformation and Rebellion in an English Village,Eamon Duffy,9780300098259
Imperial Life in the Emerald City: Inside Iraq's Green Zone,Rajiv Chandrasekaran,9781400044870
Betrayal of Trust: The Collapse of Global Public Health,Laurie Garrett/Steven M. Wolinsky,9780786884407
Crash Proof: How to Profit from the Coming Economic Collapse,Peter D. Schiff/John Downes,9780470043608
The World  the Text  and the Critic,Edward W. Said/إدوارد سعيد,9780674961876
Culture and Imperialism,Edward W. Said,9780679750543
La economía Long Tail,Chris Anderson/Federico Villegas Silva Lezama,9788493464264
Prioritizing Web Usability,Jakob Nielsen/Hoa Loranger,9780321350312
Homepage Usability: 50 Websites Deconstructed,Jakob Nielsen/Marie Tahir,9780735711020
Let My People Go Surfing: The Education of a Reluctant Businessman,Yvon Chouinard,9780143037835
The Wild Trees: A Story of Passion and Daring,Richard   Preston,9781400064892
The Boat of Dreams: A Christmas Story,Richard   Preston/George Henry Jennings,9780743245920
Strange Pilgrims,Gabriel García Márquez,9781400034697
Doce cuentos peregrinos,Gabriel García Márquez,9781400034949
Would I Lie to You (Gossip Girl  #10),Cecily von Ziegesar,9780316011839
Gossip Girl (Gossip Girl  #1),Cecily von Ziegesar,9780316910330
All I Want is Everything (Gossip Girl  #3),Cecily von Ziegesar,9780316912129
You're the One That I Want (Gossip Girl  #6),Cecily von Ziegesar,9780316735162
